company_name,job_name,location,URL,job_description
Atera Networks,Senior Full Stack Developer,Tel Aviv-Yafo,"https://www.glassdoor.com/job-listing/senior-full-stack-developer-atera-networks-JV_KO0,27_KE28,42.htm?jl=1008924129360","Israel, Tel Aviv
R&D
JOB DESCRIPTION
Atera is looking for a senior full-stack software engineer to join our team. You’ll be joining a squad focused on building features for our large-scale multi-tenant system enabling our customers to better manage their business, infrastructure, and security.
Responsibilities:
As a senior full-stack developer, you need to be comfortable around both front-end (Angular) and back-end (C# .Net Core) development. You will build end-to-end solutions encompassing web/back-end development, monitoring, scaling and optimizing to make the Atera products simple at massive scale.
You will be empowered to drive innovation by coming up with new and exciting ideas to creatively solve issues, as well as proactively look for opportunities to improve the design, interface, and architecture of Atera’s cloud platform.
Requirements:
5+ years of experience designing and building production-level web applications at a SaaS company - MUST
Proficiency in C#, .NET core (or equivalent) and experience in crafting and implementing highly scalable and performant RESTful micro-services
Proficiency with Angular 2+ (or Vue.js / React) and understanding of front-end architecture, building large-scale single-page web applications
Experience using either Azure, AWS, GCP, Kubernetes, Service Fabric, or Docker containers
Experience with modern unit testing frameworks, dependency injection and SOLID principles
Fluency in any one database technology (e.g., RDBMS like MSSQL or Postgres and/or NoSQL like DynamoDB or Cassandra)
Strong interpersonal and communication skills
More about our benefits
Atera is highly collaborative and yes, fun! To support you at work (and play) we offer some fantastic perks: ample time to learn from your teammates and contemporaries, time off to relax and recharge, community volunteer days, an annual budget to support your learning & growth, a company paid trip and lots more.
More about Atera
Atera is inventing a new way of managing IT end-to-end for IT professionals and IT teams around the world.
By creating an AI-powered IT platform, Atera's all-in-one Remote Monitoring and Management (RMM) Helpdesk, Ticketing, and Reporting solution helps more than 23,000 IT pros achieve 10X operational efficiency, cut down time-to-resolution, and deliver better outcomes faster. Located in the heart of Tel-Aviv, our team of passionate, like-minded individuals is driven by a shared mission to unleash everyone's potential and constantly innovate. We create an open, transparent, and supportive environment that gives our teams the autonomy, resources, and freedom to thrive."
Extreme Group,21959 Senior Fullstack Developer,Tel Aviv,"https://www.glassdoor.com/job-listing/21959-senior-fullstack-developer-extreme-group-JV_KO0,32_KE33,46.htm?jl=1008932454643","מס' המשרה: 21959

שם המשרה: Senior Fullstack Developer

אזור: גוש דן

תיאור של המשרה:
לארגון פיננסי מוביל במרכז דרוש/ה מפתח/ת Fullstack בכיר/ה

As a member of the R&D Team, the Fullstack Developer's role is to work with business partners to realize the full capability of the CRM. You'll be responsible for design and development of customizations, extensions, configurations, and integrations. The Fullstack Developer will be in charge of design, development, testing, and change management. Drive highly visible initiatives across the organization including building applications on the Force.com platform and supporting integrations with Salesforce.

Reauirements:
Bachelor's degree in Computer Science or a related field (Master's preferred) - Must
Minimum of 5 years of full-stack development experience, with a strong focus on both front-end and backend development. - Must
Minimum of 5 years of proficiency in backend technologies, including but not limited to Node.js, Python, Ruby, or Java. - Must
Minimum of 5 years of proficiency in front-end technologies, including JavaScript, HTML, CSS, and relevant frameworks. - Must
Experience with version control systems (e.g., Git) and CI/CD pipelines. - Must
Familiarity with agile development methodologies. - Must

Advantages

Any Salesforce experience or certifications would be an advantage but are not mandatory.
Prior experience with data migration and ETL/integration tools – Plus
Database and data-modeling knowledge (SQL, NoSQL, Schema Design)
Familiarity with Usability Tests
Familiarity with Google Analytics

הגשת מועמדות למשרה

העלאת קורות חיים

בכדי שנוכל להציע לך משרות שמתאימות לך, מומלץ להשלים את השאלות הבאות (לא חובה):

סוג הארגון המבוקש?
ארגון
סטארט-אפ
לא משנה

סוג העסקה מבוקש?
שכיר/ה
פרילנסר/ית

היקף משרה מבוקשת? מלאה50-100%0-50%לפי שעות

מיקום גיאוגרפי מבוקש? צפוןשרוןשפלהמרכזדרום

אני מאשר/ת קבלת הצעות עבודה במייל/טלפונית/SMS

למשרות נוספות בתחום ה-Development »"
